{
  "primer_gc_clamp": 1,
  "primer_max_end_gc": 0,
  "primer_opt_size": 21,
  "primer_min_size": 19,
  "primer_max_size": 29,
  "primer_max_ns_accepted": 1,
  "primer_product_size_range": "300-500",
  "primer_pair_wt_product_size_gt": 0.12,
  "primer_pair_wt_product_size_lt": 0.12,
  "primer_min_tm": 55,
  "primer_max_tm": 75,
  "primer_num_return": 100
}